id;column_combination;accuracy;f1_score_class_0;f1_score_class_1;anonymization
0;;0.8709784411276948;0.9167914438502672;0.7129151291512915;no
1;age_manipuliert, sex_manipuliert, race_manipuliert;0.825428413488115;0.8779469737960888;0.6935765573452358;basic
2;age_manipuliert, sex_manipuliert, race_manipuliert, native-country_manipuliert, education_manipuliert, occupation_manipuliert;0.7943615257048093;0.8513189448441247;0.6666666666666666;moderate
3;age_manipuliert, sex_manipuliert, race_manipuliert, native-country_manipuliert, education_manipuliert, occupation_manipuliert, marital-status_manipuliert, capital-gain_manipuliert, capital-loss_manipuliert, hours-per-week_manipuliert;0.2437810945273631;0.0;0.392;strong
4;age_manipuliert, fnlwgt_manipuliert, capital-gain_manipuliert, capital-loss_manipuliert, hours-per-week_manipuliert, sex_manipuliert, workclass_manipuliert, education_manipuliert, marital-status_manipuliert, occupation_manipuliert, relationship_manipuliert, race_manipuliert, native-country_manipuliert;0.2437810945273631;0.0;0.392;complete
